,title,link,content
3014,"현대차, 코나 전기차 배터리 전량 교체… ""결함 조사는 진행 중""(종합)",https://biz.chosun.com/site/data/html_dir/2021/02/24/2021022401604.html?utm_source=naver&utm_medium=original&utm_campaign=biz,"배터리 일부, 셀 제조불량 및 BMS 오적용에 따른 화재 가능성 현대차(005380)가 최근 잇단 화재로 논란이 된 코나 전기차(EV) 배터리를 자발적으로 모두 교체하기로 했다. 현대차와 배터리를 공급한 LG에너지솔루션..."
3015,"'SUV의 힘' 현대차·기아, 미국시장 역대 최대기록 썼다",http://www.fnnews.com/news/202104020954176617,"현대차·기아가 3월 미국시장에서 역대 최다 판매기록을 세웠다. 2일 현대차그룹에 따르면 현대차는 지난달 미국시장에서 7만8409대, 기아는 6만6523대 등 전년 동월대비 77.8% 증가한 총 11만4932대를 팔았다...."
3016,"현대차, 21년형 엑시언트 수소전기트럭 출시..올해 스위스 140대 선적",http://www.breaknews.com/808976,엑시언트 수소전기트럭은 현대차가 세계 최초로 양산한 대형 수소전기트럭으로... 현대차는 2025년까지 이미 인도한 물량을 포함해 총 1600 대의 수소전기트럭을...
3017,"현대차 3, LG에너지 7 ""코나EV 등 리콜 비용 합의""",https://news.imaeil.com/Enterprise/2021030416470926492,"앞서 현대차는 2017년 11월부터 2020년 3월까지 생산해 전 세계에 판매한 코나EV, 아이오닉EV, 일렉시티버스... 총 리콜 비용은 1조원 안팎으로 추산되는데, 30%를 부담하게 된 현대차는 지난해 4분기 영업익에 리콜 비용..."
3018,글로벌 수소경쟁…SK·현대차 만들겠다는 '블루수소' 뭐가 다를까,http://news.mt.co.kr/mtview.php?no=2021030216005841235,"현대차그룹과 포스코그룹이 2030년부터 그린수소 프로젝트를 예고한 상황에서 미래수소시장 선점 경쟁이... 현대차 2030년 블루, 2050년 그린수소 로드맵…韓 수소경제 착착 현대차그룹과 포스코도 움직인다. 부생수소로..."
3019,"현대차, 반도체 보릿고개에 ‘아이오닉5’ 출고 안간힘",https://www.dnews.co.kr/uhtml/view.jsp?idxno=202105191010377650243,19일 업계에 따르면 현대차는 전날까지 초기 계약한 아이오닉5의 옵션을 바꿀 수 있는 2차 계약변경(컨버전)을 진행했다. 현대차는 차량용 반도체 부족으로 아이오닉5의 출고가 지연되자 고객들에게 일부 선택사양을...
3020,"현대차, 반도체 보릿고개에 ‘아이오닉5’ 출고 안간힘",https://www.dnews.co.kr/uhtml/view.jsp?idxno=202105191010377650243,19일 업계에 따르면 현대차는 전날까지 초기 계약한 아이오닉5의 옵션을 바꿀 수 있는 2차 계약변경(컨버전)을 진행했다. 현대차는 차량용 반도체 부족으로 아이오닉5의 출고가 지연되자 고객들에게 일부 선택사양을...
3021,"현대차, SUV로 고성능 라인업 확대…'코나 N' 공개",http://www.inews24.com/view/1362163,현대차는 27일 온라인을 통해 '현대 N Day' 행사를 개최하고 '코나 N'을 세계 최초로 공개했다. 코나 N은 현대차의 첫 번째 고성능 SUV 모델로 기존 N 브랜드 라인업에 SUV의 실용성을 갖춘 모델을 더함으로써 고성능을...
3022,"현대차-LG에너지솔루션, 코나 리콜비용 합의…""LG가 70% 부담""",http://www.fnnews.com/news/202103041657184710,코나EV의 전체 리콜 비용은 약 1조원 규모로 비용은 현대차와 LG에너지솔루션이 각각 3대 7을 분담키로 했다. 이에 따라 현대차는 이날 코나EV 리콜 충당금 3866억원 지난해 영업이익에 반영한다고 밝혔다....
3023,"현대차·기아, 지난달 美판매 역대 최다.. '반도체 품귀' 5월이 고비",https://www.sedaily.com/NewsView/22M7TRVJHX,"현대차(005380) 북미 법인 역시 지난달 전년 대비 128% 증가한 7만 7,523대(제네시스 제외)를 판매해 3월에... 3월 제네시스 브랜드 총 판매량이 3,006대에 달했다는 점을 고려하면 지난달 현대차의 판매량도 3월..."
3024,"토스증권 ""첫 계좌개설하면 삼성전자·현대차 등 1주 선물""",http://www.newspim.com/news/view/20210518000971,주식은 ▲삼성전자 ▲현대차 ▲네이버 등 시가총액 상위 종목을 포함해 총 26개 종목 중에서 제공된다. 이벤트에 참여하려면 토스 애플리케이션 내 주식탭을 통해 토스증권 모바일트레이딩시스템(MTS)에 접속하면 된다....
3025,"현대차, '태양광·그린에너지' 등 지속가능 미래솔루션 공개",https://view.asiae.co.kr/article/2021050614033293511,"현대차와 UNDP는 원활한 프로젝트 추진을 위해 누구나 지속가능한 미래에 대한 솔루션을 제안하고... 현대차 관계자는 ""현대자동차는 'for Tomorrow' 프로젝트를 통해 브랜드 비전인 '인류를 위한 진보(Progress for..."
3026,처음 모습 드러낸 현대차 '아이오닉 5'… 1회 충전에 430㎞ 주행(종합),https://biz.chosun.com/site/data/html_dir/2021/02/23/2021022302182.html?utm_source=naver&utm_medium=original&utm_campaign=biz,"현대차는 오는 25일부터 아이오닉 5의 국내 사전 계약을 시작한다. 아이오닉 5는 1회 충전에 최대 430㎞를 달릴 수 있고 판매 가격은 장거리 모델 기준, 트림에 따라 5000만원 초반~중반으로 정해졌다. 이날 현대차는..."
3027,현대차·기아 '발명의 날' 우수 특허 8건 선정 포상,http://www.ksilbo.co.kr/news/articleView.html?idxno=901180,"현대차·기아는 최근 남양연구소에서 '발명의 날' 행사를 열고 우수 특허 8건을 포상했다고 24일 밝혔다. 올해는 작년 현대차·기아에서 특허로 출원한 3100여건의 사내 발명 아이디어 중 자율주행, 도심항공모빌리티..."
3028,"원희룡 ""MZ세대 노조, 현대차 노조 창피해 해..합리적 개혁 기대""",http://www.fnnews.com/news/202105011029121800,"원 지사는 이어 ""'그동안 노조가 무논리와 억지, 응석받이 행태를 보일 때마다 어디 가서 현대차 직원이라고 말하기 창피했다'는 자성의 목소리에 MZ세대가 동감하고 있다""고 강조했다. 그러면서 ""그들이 하나둘씩 노조를..."
3029,"현대차·기아, 올해 中서 81만7000대 판다…작년보다 23% 상향",http://www.fnnews.com/news/202103101540243308,"10일 현대차·기아에 따르면 올해 중국 시장 판매 목표를 현대차 56만2000대, 기아 25만5000대 등 총 81만7000대로 잡았다. 이는 양사의 지난해 중국 시장 합산 판매량 대비 23% 상향한 것이다. 현대차·기아의 지난해 중국..."
3030,"현대차·기아, 모빌리티 총괄 'TaaS본부' 신설…본부장에 송창현",http://yna.kr/AKR20210416103000003?did=1195m,모빌리티 전략 수립·사업화 등 총괄…모빌리티 생태계 조성에 역할 기대 현대차·기아는 글로벌... 기여했다고 현대차는 전했다. 2019년에는 모빌리티 서비스 스타트업인 포티투닷을 창업해 최근까지 도심형...
3031,현대차·글로비스 백신 휴가제 도입...접종 직원에 이틀간 유급휴가,http://www.smartfn.co.kr/view.php?ud=202106021134054954d5d29c6899_46,현대차와 현대글로비스가 이달부터 신종 코로나바이러스 감염증(코로나19) 백신을 접종한 직원에게 이틀간 유급 휴가를 시행한다. 2일 업계에 따르면 현대차는 전날 노조와 협의를 통해 백신을 접종한 직원이 접종 당일과...
3032,현대차·기아 공장 줄줄이 '셧다운'… 車반도체 보릿고개 현실화,http://www.getnews.co.kr/news/articleView.html?idxno=530478,세계적으로 차량용 반도체 수급난이 장기화되면서 현대차와 기아 등이 잇따라 공장 휴업을 결정한 것. 이에 따라 투싼과 아반떼 등 인기 차종의 출고 지연이 불가피할 것으로 보인다. 14일 업계에 따르면 현대차는 오는 17...
3033,"현대차, 내년 미국서 전기차 생산…""5년간 74억 달러 투자""",https://news.joins.com/article/olink/23652222,현대차그룹이 미국에서 전기차를 생산한다고 14일 밝혔다. 현대차그룹의 해외 전기차 생산라인으로는 코나 일렉트릭(EV)을 생산하는 체코공장에 이어 두 번째가 된다. 현대차그룹은 이를 위해 올해부터 2025년까지 5년간...
3034,모터레이싱 저변 확대 나선 현대차…아마 레이싱팀 ‘TEAM HMC 후원,https://sports.donga.com/article/all/20210509/106833741/3,현대차는 서울시 강남구 오토웨이타워에서 현대차 국내사업본부장 유원하 부사장과 ‘TEAM HMC’ 레이싱팀 김주현 단장 등이 참석한 가운데 ‘현대차-TEAM HMC 후원 협약식(사진)’을 진행했다고 9일 밝혔다....
3035,"""혼자서 4940대 판매""…현대차 최초 '여성 판매왕' 나왔다",http://news.mk.co.kr/newsRead.php?no=102316&year=2021,코로나19로 자동차 대면 영업이 어려웠던 지난해에만 하루에 한 대 이상 실적을 올린 현대차 판매직원이 '판매왕'으로 선정됐다. 여성 최초 '현대차 판매왕'이라는 기록도 세웠다. 현대차는 2020년 전국 판매 우수자...
3036,"현대차 체코공장, '체코 국가 품질상' 최우수상 4회 연속 수상",http://www.kmaeil.com/news/articleView.html?idxno=282259, 현대차는 19일(현지 시각) 체코 산업통상부 청사에서 열린 '2020 체코 국가 품질상' 시상식에서... 이날 시상식은 카렐 하블리첵 체코 산업통상부 장관 겸 경제 부총리 등 주요 정부인사와 백철승 현대차...
3037,"""현대차·기아, 애플카 생산 협상 막바지""",https://view.asiae.co.kr/article/2021020409122004782,애플과 현대차·기아 간의 자율주행 전기차 위탁 생산을 위한 협상이 막바지로 향하고 있다고 미 경제 매체... 또 소식통들은 아직 애플과 현대차·기아 사이에 최종 합의는 이뤄지지 않았으며 애플이 다른 완성차업체와...
3038,현대차 '스타리아' 공개…15일부터 판매,http://news.tvchosun.com/site/data/html_dir/2021/04/13/2021041390043.html,다목적차량(MPV)인 현대차 스타리아가 13일 월드 프리미어 영상을 통해 공개됐다. 스타리아는 현대차가 22년만에 선보이는 MPV 차량으로 15일부터 판매된다. 스타리아는 이동수단의 다양한 공간 활용성에 대한...
3039,"현대차, 연구개발본부 경력사원 채용…28일까지 접수",http://yna.kr/AKR20210412028200003?did=1195m,서류는 이날부터 28일까지 현대차 채용 홈페이지(http://recruit.hyundai.com)를 통해 접수할 예정이다. 모집... 현대차는 연구개발 부문의 우수 인재를 공격적으로 채용해 미래 스마트 모빌리티 솔루션 구축을 위한 핵심...
3040,"현대차, 연구개발본부 경력사원 채용…28일까지 접수",http://yna.kr/AKR20210412028200003?did=1195m,서류는 이날부터 28일까지 현대차 채용 홈페이지(http://recruit.hyundai.com)를 통해 접수할 예정이다. 모집... 현대차는 연구개발 부문의 우수 인재를 공격적으로 채용해 미래 스마트 모빌리티 솔루션 구축을 위한 핵심...
3041,"그랜저마저...현대차, 아산공장 휴업 검토",https://www.sedaily.com/NewsView/22KYU1I36J,아산공장에서는 현대차(005380)의 주력 세단인 그랜저 등이 생산되고 있다. 5일 업계에 따르면 현대차 아산공장 실무진은 노동조합측에 7~9일 3일간 휴업하고 12~15일엔 절반만 가동하는 방안을 제시했다. 이에 노조가...
3042,"[단독]""정몽구→정의선"" 현대차, 공정위에 총수 변경 요청",http://news.mt.co.kr/mtview.php?no=2021030114444728976,현대자동차가 공정거래위원회에 총수(동일인)를 정몽구 현대차그룹 명예회장에서 정의선 회장으로 변경해 줄 것을 요청했다. 공정위가 현대차 요청을 수용할 경우 현대차는 21년 만에 총수가 바뀌게 된다. 1일 업계에...
3043,반도체 쇼티지에 현대차 울산 포터 생산라인 6~7일 휴업,https://www.sedaily.com/NewsView/22M7UMHXK9,3일 자동차 업계에 따르면 현대차는 계기판에 사용되는 차량용 반도체 재고 부족으로 울산4공장을 이틀간 휴업하기로 결정했다. 현대차는 앞서 지난달 7∼14일 반도체와 구동모터 수급 문제로 전용 전기차 아이오닉 5와...
3044,"현대차, 상용차 고객 대상 케어 서비스 실시",https://www.hankyung.com/economy/article/202104140544g,"현대차는 이번 서비스에서 △타이어, DPF(매연저감장치) 등 차량 기본 항목 점검 △필터, 냉매 등 에어컨 무상 점검을 실시한다. 차내 방역서비스도 제공한다. 현대차 관계자는 ""자칫 소홀하기 쉬운 차량 기본..."
3045,자동차 수요 회복에 현대차 1분기 호실적…“영업익 92%↑”,http://news.kbs.co.kr/news/view.do?ncd=5169092&ref=A,"현대차는 올해 1분기 연결기준 영업이익이 1조 6,566억 원을 기록해 지난해 같은 기간보다 91.8% 증가했고, 매출액은 8.2% 증가한 27조 3,909억 원으로 집계됐다고 밝혔습니다. 현대차는 주요 국가들의 수요 회복 영향으로..."
3046,"현대차, 방탄소년단 수소 캠페인 영상 공개",http://autotimes.hankyung.com/apps/news.sub_view?popup=0&nid=03&c1=03&c2=03&c3=00&nkey=202104210949191,현대차는 2020년부터 방탄소년단과 함께 'Because of You'라는 슬로건 아래 미래 청정에너지 '수소'의... 또한 영상에는 물 이외의 오염물질을 배출하지 않는 수소전기차 '넥쏘(NEXO)'가 등장해 선한 에너지 '수소'와 현대차가...
3047,"현대차 ""쏘나타급 중형 전기차 '아이오닉6' 내년 하반기 출시""…주행거리 300마일 이상 전망",http://www.newsworks.co.kr/news/articleView.html?idxno=550552,26일 업계에 따르면 현대차는 24일(현지시간) 북미에서 진행한 아이오닉5 미디어 브리핑에서... 현대차는 미국 전기차 시장 2위 업체를 목표로 아이오닉6와 아이오닉7의 미국 현지 생산도 고려하고 있는 것으로...
3048,현대차·기아 “애플과 자율주행차량 개발 협의 진행하고 있지 않아”,http://news.kbs.co.kr/news/view.do?ncd=5113338&ref=A,"지난달 8일 일부 매체는 '현대차그룹이 애플과 협상을 진행 중이다'라고 보도했으며 당시 현대차 측은 해당 보도에 대해 ""초기 단계로 아직 결정된 것은 없다""고 설명한 바 있습니다. 당시에는 현대차가 애플과의 협의..."
3049,"현대차·기아, 17~18일 일부 공장 휴업...반도체 부족에 생산차질",http://www.wsobi.com/news/articleView.html?idxno=121758,현대차는 지난 6~7일 계기판 관련 반도체 부족으로 울산4공장 포터 생산라인을 멈춰세운데 이어 17~18일... 반도체 수급난에 따른 생산 차질이 이어지자 현대차 그룹은 출고를 기다리고 있는 소비자들에게 차량 인도 지연에...
3050,"현대차, '사회공헌백서' 국제홍보물 경연서 4개상 수상",http://www.smedaily.co.kr/news/articleView.html?idxno=203686,현대차그룹은 세계 3대 홍보물 경연대회 중 하나로 평가되는 '아스트리드 어워즈(Astrid Awards) 2021'에 사회공헌활동 백서 2019를 출품해 부문 최우수상인 금상을 비롯해 2개의 상을 받았다고 14일 밝혔다. 현대차그룹은...
3051,"'시작이 좋다!' 현대차, 스타리아·아이오닉5 사전계약 흥행 또 흥행",http://www.bloter.net/archives/537683,"현대차 미래차 전략의 핵심이라는 점에서 이번 흥행은 의미가 크단 해석이다. 올해 판매 확대를 통해 수익성을 개선하고, 미래차 주도권을 확보하겠다는 회사의 목표 달성에도 속도가 붙을 전망이다. 26일 현대차에..."
3052,"현대차, 코로나19가 인도공장 멈춰 세워",http://www.businesskorea.co.kr/news/articleView.html?idxno=68054,"인도에서 닛산, 현대차와 제휴하고 있는 르노자동차가 코로나19 감염병 확진자 수가 폭증함에 따라... 현대차도 타밀나두 주에 코로나19 확진자수가 급증하고 있는 가운데 24일 일부 노동자들이 연좌농성을 하자..."
3053,"""수소 비전 알린다""…현대차, 수소 상용차 웹사이트 선보여",https://www.hankyung.com/economy/article/202104203498g,현대차는 '현대 수소 트럭&버스' 사이트를 통해 △차별화된 수소 기술력과 △수소 관련 히스토리 및 비전 등을 적극적으로 알릴 계획이다. 이를 통해 수소 상용차 잠재 고객 및 일반 대중들을 대상으로 현대차의 브랜드...
3054,현대차·기아 “애플과 자율주행차 개발협의 진행 안 해”(종합),https://biz.chosun.com/site/data/html_dir/2021/02/08/2021020800663.html?utm_source=naver&utm_medium=original&utm_campaign=biz,"업계는 ""현대차그룹·애플, 다른 분야에서 협력할 가능성도"" 현대자동차그룹이 8일 ""애플과 자율주행차량 개발에 대한 협의를 진행하고 있지 않다""고 밝혔다. 현대차그룹은 지난달 9일 애플과의 협력과 관련된 보도가..."
3055,"투싼·아반떼 등 생산 차질… 현대차, 17~18일 울산 5공장 스톱",http://biz.newdaily.co.kr/site/data/html/2021/05/14/2021051400011.html,14일 업계에 따르면 현대차는 울산 5공장 2라인의 가동을 오는 17~18일 중단한다. 이곳은 준중형... 현대차는 에어백컨트롤유닛(ACU)에 쓰이는 반도체 확보에 어려움을 겪는 것으로 전해졌다. 기아 역시 오는 17~18일 소하...
3056,[단독]SK·현대차도 수소동맹…정세균·최태원·정의선 내일 만난다,http://news.mt.co.kr/mtview.php?no=2021030112552594877,SK그룹은 이 자리에서 현대차그룹과 수소사업 협업을 발표할 예정이다. SK가 대량의 액화수소를 생산하면 현대차가 이를 운송하기 위해 수소트럭을 공급하는 형태의 협업이 될 것으로 보인다. 1일 관련업계에 따르면 정...
3057,"현대차, 美 그린뉴딜에 5년간 8조원 선제투자...삼성 발표도 임박",http://www.newsquest.co.kr/news/articleView.html?idxno=84501,[사진=현대차 HMG저널] 현대자동차그룹이 향후 5년간 미국 시장에 74억달러(약 8조1417억원)을 투자해 전기... 친환경 전환을 강조하는 미국 조바이든 대통령의 '그린뉴딜' 기조에 따라 현대차가 현지 시장을 공략하기 위해...
3058,현대차 '아이오닉 5' 오늘 첫 공개…1회 충전 500㎞ 주행,http://www.wowtv.co.kr/NewsCenter/News/Read?articleId=A202102230021&t=NN,현대차는 23일 오후 4시 현대차그룹 공식 유튜브 채널 등을 통해 전세계에 아이오닉 5를 최초 공개할 예정이다. 올해를 전기차 도약 원년으로 선포한 현대차는 아이오닉 5 출시를 시작으로 본격적으로 전기차 라인업을...
3059,"현대차, 혁오 온라인 콘서트에 '엑시언트 수소전기트럭' 지원",http://yna.kr/AKR20210322037100003?did=1195m,현대차는 지난해 7월 엑시언트 수소전기트럭을 세계 최초로 양산해 스위스에 수출한 것을 시작으로 글로벌 시장에서 친환경 상용차의 입지를 다지기 위해 지원을 결정했다고 설명했다. 이날 현대차 공식 SNS에 공개된...
3060,"현대차·기아, 전기차 전세계서 4번째로 많이 팔았다",http://moneys.mt.co.kr/news/mwView.php?no=2021031116218092781,"현대차·기아가 전기차 시장 전체 4위를 차지했다. 한국자동차산업협회가 11일 발간한 '2020년 주요국... 현대차 코나EV는 5만5981대를 팔아 5위 차지했다. 정만기 KAMA 회장은 ""지난해 전기동력차 시장은 코로나19..."
3061,대한상의 '탄소중립 연구조합' 설립…현대차·SK하이닉스 참여,http://yna.kr/AKR20210415160400003?did=1195m,"탄소중립 연구조합에는 현대차와 SK하이닉스, 포스코, 한국반도체산업협회 등 14개 기업과 단체가 참여하고, 향후 참여 기업·단체를 확대할 예정이다. 앞으로 탄소중립 연구조합이 탄소중립 기술 개발과 사업화..."
3062,"[단독] 현대차, 獨 지멘스에 현대로템 지분 매각",https://biz.chosun.com/site/data/html_dir/2021/04/20/2021042001292.html?utm_source=naver&utm_medium=original&utm_campaign=biz,"현대차는 현대로템 지분 33.8%(작년말 기준)를 가진 최대주주다. 지멘스가 현대로템의 경영권을 인수하려면 현대차가 가진 지분 전량을 인수할 가능성이 크지만, 전량을 인수할지 일부만 인수할지는 확인되지..."
3063,"기아, 안방서 현대차 제쳤다… 해외서도 ‘격전’",http://www.fnnews.com/news/202105131803081338,올해 들어 기아의 국내 판매 실적이 현대차를 추월한 것으로 나타났다. 미국 등 해외 주요 시장에서도 현대차와의 판매 격차가 6% 수준으로 좁혀지는 등 기아의 성장세가 무섭다. 13일 관련 업계에 따르면 올해 1...
3064,"현대차-쉘, 협력 강화로 미래 모빌리티 변화 선도",http://www.newsis.com/view/?id=NISX20210318_0001375637&cID=13001&pID=13000,현대차는 18일 현대모터스튜디오 고양에 중계센터를 설치 쉘 관계자들과 온라인 화상회의로 글로벌 비즈니스 파트너십을 연장하는 계약을 체결했다. 현대차와 쉘은 2005년부터 글로벌 고객 만족도 개선 및 서비스 경쟁력...
3065,"현대차·기아-sk이노베이션, 하이브리드카 배터리 공동 개발",https://www.donga.com/news/article/all/20210416/106446188/2,현대차·기아와 SK이노베이션은 전동화 차량에 최적화한 파우치형 배터리를 개발해 오는 2024년부터 실제 차량에 장착하는 것을 목표로 협력에 나선다. 양측은 현대차·기아가 향후 출시할 차량 특성에 최적화한 배터리를...
3066,"제시카 알바의 선택, '현대차 for Tomorrow'",http://moneys.mt.co.kr/news/mwView.php?no=2021050618038085952,7일 현대차에 따르면 'for Tomorrow'는 현대차와 UNDP(유엔개발계획)가 함께 진행하는 프로젝트다. 교통·주거·환경 등 글로벌 사회가 직면한 문제를 해결하고 더 나은 내일을 만들기 위해 전세계 각계 구성원들의...
3067,"현대차, 고성능 브랜드 최초의 SUV '코나 N' 공개…제로백 5.5초",https://www.etoday.co.kr/news/view/2020016,현대차) 현대자동차가 첫 번째 고성능 SUV '코나 N'을 27일 공개했다. 코나 N은 기존 N 브랜드 제품군에 SUV의 실용성을 갖춘 모델을 더함으로써 고성능을 추구하는 고객들에게 선택의 폭을 넓혀줄 전망이다. 현대차...
3068,"현대차, 전기차 고객 위한 '픽업앤충전 서비스' 런칭",http://www.wikileaks-kr.org/news/articleView.html?idxno=107797,현대차는 '픽업앤충전 서비스' 런칭을 통해 충전하러 갈 시간이 없거나 주변에 충전기가 없어 어려움을... 현대차의 '픽업앤충전 서비스'에 관한 보다 자세한 내용은 현대자동차 홈페이지 또는 마이현대 앱 등을 통해...
3069,"현대차·기아, 서울시립미술관-분당서울대병원과 ‘자율주행 휠체어’ 맞손",http://www.viva100.com/main/view.php?key=20210527010005853,"현대차·기아, 서울시립미술관-분당서울대병원과 ‘자율주행 휠체어’ 맞손 현대자동차와 기아가 서울시립미술관, 분당서울대학교병원과 이동약자의 이동 편의성 증진을 위해 손을 잡는다.현대차·기아와 서울시립미술관..."
3070,"현대차, 적립 혜택 늘린 'Hyundai Mobility 카드' 출시",http://www.etnews.com/20210426000022,"적립되는 현대차 전용 카드로 신차 구매고객에게 필요한 혜택을 중심으로 모빌리티 라이프에 특화한 것이 특징이다. 등급은 기본형(Basic)과 플래티넘(Platinum) 두 가지다. 현대차는 주유, 정비, 세차 등 차량 유지..."
3071,"현대차·LG에너지솔루션, 코나 EV 리콜 비용 '3대 7' 분담 합의",http://news.tf.co.kr/read/economy/1846401.htm,현대차는 4일 연결재무제표 기준 지난해 잠정 영업이익을 2조7813억 원에서 2조3947억 원으로 정정한다고 공시했다. 코나 EV 등 자발적 리콜 관련 품질 비용 3866억 원을 반영한 것이다. 앞서 현대차는 지난 2017년...
3072,"현대차·SK이노, 하이브리드카 배터리 공동개발",https://www.hankyung.com/economy/article/2021041625521,새 배터리는 현대차가 2024년 선보일 하이브리드카에 탑재된다. 두 회사가 단순 납품 관계를 넘어 산업 생태계를 주도할 협업 모델을 만들었다는 평가가 나온다. 정의선·최태원 회동 후 협력 강화 현대차·기아는...
3073,"현대차, 전기차 충전과 세차 대행까지… 신개념 충전서비스 선 봬",http://www.joseilbo.com/news/news_read.php?uid=423294&class=80&grp=,"'픽업앤충전 서비스'는 현대차의 전기차를 보유한 고객을 대상으로 고객이 원하는 위치에서 차량을 픽업해... 아이오닉 5, 코나 일렉트릭, 아이오닉 일렉트릭에 제공되는 '픽업앤충전 서비스'는 현대차의 통합 고객..."
