,title,link,content
1990,"현대차, 장애인 위해 수동휠체어에 모터장착 지원",http://www.smedaily.co.kr/news/articleView.html?idxno=204015,"이병훈 현대차그룹 상무, 변승일 한국장애인단체총연맹 공동대표가 전동화키트를 전달받은 장애인 다섯 분과 기념촬영을 하고 있다. 현대차그룹이 장애인 이동편의를 위해 수동휠체어 전동화키트 보급·셰어링 사업을..."
1991,현대차 1분기 영업익 92% 증가...제네시스-SUV 효과,http://www.fnnews.com/news/202104221438210467,"■SUV 판매 증가…현대차 영업익 92% 증가 22일 현대차는 경영실적 컨퍼런스콜에서 연결기준 1분기 매출액 27조3909억원, 영업이익 1조6566억원, 당기순이익 1조5222억원을 올렸다고 밝혔다. 전년동기 대비 매출은 8.2..."
1992,"현대차, 콩고민주공화국에 팰리세이드 500대 수출",http://www.mediapen.com/news/view/628478,현대차가 콩고민주공화국 정부 대상 대규모 차량 공급을 통해 아프리카 신 시장 개척에 나섰다. 현대차는 지난 15일 평택항에서 콩고민주공화국(DR콩고)으로 수출되는 대형 스포츠유틸리티차량(SUV) 팰리세이드 500대 중...
1993,[장중시황] 코스피 3190선 터치…현대차·기아 주가↑,https://economist.co.kr/2021/05/28/stock/stockNormal/20210528114300408.html,운수장비 업종 가운데 현대차(4.5%) 기아(4.5%) 주가는 나란히 상승했다. GM이 반도체 수급 문제로 중단된 공장을 재가동한다는 소식이 주가 상승 재료가 됐다. 한국항공우주(1.4%) 한화에어로스페이스(0.6%) 주가는...
1994,차반도체 부족 사태 장기화...현대차 일부 공장 가동 중단,https://www.news1.kr/photos/view/?4778712,20일 오전 현대자동차 울산공장에서 우산을 쓴 직원이 자전거를 타고 이동하고 있다. 현대차는 차량용 반도체 공급 부족 사태가 장기화되면서 18일부터 이날까지 울산3공장의 가동을 중단하고 있다. 2021.5.20/뉴스1
1995,현대차-LG엔솔 손잡고 동남아 전기차 공략 기지 인도네시아에 설립,https://www.ebn.co.kr/news/view/1484942/?sc=Naver,26일 업계에 따르면 현대차와 LG에너지솔루션은 1조원~1조3000억원을 투자해 인도네시아 수도 자카르타... 현대차는 동남아시장 공략을 위해 인도네시아를 전초기지로 삼고 있다. 인도네시아에 연간 25만대 생산...
1996,"삼성, 파운드리 공장 170억弗…현대차, 전기차에 74억弗 쏜다",https://www.hankyung.com/politics/article/2021052274201,"한국 기업들이 44조원 넘는 미국 투자계획을 발표했다. 21일(현지시간) 한·미 정상회담을 계기로 워싱턴DC에서 열린 ‘한·미 비즈니스 라운드 테이블’ 행사에서다. 양국 기업들은 반도체, 배터리, 바이오 등 핵심..."
1997,생산 재개한 울산공장…車 반도체에 답답한 현대차,https://www.news1.kr/articles/?4313840,"23일 업계에 따르면, 현대차는 최근 생산을 중단했던 울산5공장 52라인을 20일부터 생산을 재개했고, 울산3공장은 21일부터 생산을 재개했다. 앞서 현대차는 에어백컨트롤유닛(ACU) 등 차량용 반도체 수급 문제로 준중형..."
1998,"현대차 북미본부, 美 해병대 대령 출신 홍보 담당 채용",https://www.theguru.co.kr/news/article.html?no=21765,현대차 북미권역본부는 24일(현지시간) 미 해병 대령 출신 사라 풀우드(Sarah Fullwood)를 홍보·커뮤니케이션... 풀우드는 현대차와 고급 브랜드 제네시스에 대한 홍보 전략과 앨라배마 공장과의 커뮤니케이션을...
1999,"현대차, 차량용 반도체 부족에 일부 공장 휴업",http://yna.kr/PYH20210518154500057?did=1196m,반도체 부족 사태가 장기화하면서 현대자동차가 18일 투싼과 수소전기차 넥쏘를 생산하는 5공장 2라인과 아반떼와 베뉴를 생산하는 3공장 가동을 중단했다. 이날 오후 울산시 북구 현대차 울산공장 모습. 2021.5.18
2000,"현대차, 차량용 반도체 부족에 일부 공장 휴업",http://yna.kr/PYH20210518154500057?did=1196m,반도체 부족 사태가 장기화하면서 현대자동차가 18일 투싼과 수소전기차 넥쏘를 생산하는 5공장 2라인과 아반떼와 베뉴를 생산하는 3공장 가동을 중단했다. 이날 오후 울산시 북구 현대차 울산공장 모습. 2021.5.18
2001,"""신세계, 하반기에도 실적 모멘텀 양호""-현대차證",http://www.weeklytoday.com/news/articleView.html?idxno=369360,"이에 현대차증권은 백신 보급에 속도가 붙어 소비심리 및 경기 회복에 긍정적 영향을 제공할 것이라며, 투자의견 '매수(BUY)'와 목표주가 46만 원을 유지했다. 27일 현대차증권은 신세계의 2분기 연결기준 총매출액으로..."
2002,"현대차, 2021년형 ‘엑시언트’ 수소전기트럭 출시",http://www.viva100.com/main/view.php?key=20210525010005085,"현대차, 2021년형 ‘엑시언트’ 수소전기트럭 출시 현대자동차가 2021년형 ‘엑시언트’ 수소전기트럭을 출시했다고 25일 밝혔다. 엑시언트 수소전기트럭은 현대차가 세계 최초로 양산한 대형 수소전기트럭이다...."
2003,"[속보] 현대차, 1분기 영업익 1.6조…전년比 92%↑",http://news.tf.co.kr/read/economy/1856239.htm,"현대차 ""2분기, 반도체 공급부족·코로나19 재확산 우려 남아"" 현대자동차(현대차)가 연결재무제표 기준으로 올해 1분기 1조6566억 원의 영업이익을 기록했다고 22일 밝혔다. 이는 지난해 동기 대비 91.8% 늘어난 수치다...."
2004,현대차 체코공장 '체코 국가 품질상' 최우수상 4회 연속 수상,http://www.enewstoday.co.kr/news/articleView.html?idxno=1480743,"현대차는 19일 현지 시각 체코 산업통상부 청사에서 열린 '2020 체코 국가 품질상' 시상식에서 현대자동차... 왼쪽부터 백철승 현대차 체코생산법인장, 마틴 클리츠닉 체코생산법인 품질부실장. 현대차는 19일 현지..."
2005,"대선 출마 박용진, 현대차 노조부터 찾아간 이유",http://www.hani.co.kr/arti/economy/marketing/994984.html,박 의원은 12일 <한겨레>와 한 통화에서 “현대차 노조는 민주노총 최대 사업장이라는 상징성이 있다”며... 이날 박 의원은 현대차 노조의 교육위원들을 만났다고 했다. 그는 “제 말에 거세게 반발할 줄 알았지만 오히려...
2006,전기차 배터리 전력을 건물에 공급한다…현대차·제주도 맞손,http://yna.kr/AKR20210507101800003?did=1195m,기아·현대캐피탈과 전기차 기반 V2G 시범사업 MOU…상용화 발판 마련 현대차와 기아가 전기차를 전력망과 연결해 배터리 전력을 활용하는 기술인 'V2G(Vehicle To Grid)' 상용화 시대 구축에 나선다. 현대차와 기아...
2007,"[단독] '조기퇴근'자도 징계 기록 삭제…현대차 노조, '대사면' 요구",https://www.asiatime.co.kr/article/20210525500020,"현대차 노조, '조합원 징계 기록 없애자' 현대차 노사 26일 임단협 상견례 노조 사측에 '대사면' 등 13가지 요구 현대차 노조가 지난 12일 울산 북구 현대차 문화회관에서 올해 임·단협 요구안을 논의하기 위해..."
2008,"현대차·기아, 1~4월 中 시장점유율 2.6% '존재감 미미'",https://www.theguru.co.kr/news/article.html?no=21631,2%에서 '나홀로 하락' 전기차 중심 재도약 전략 발표했으나…반등은 '글쎄' 현대차와 기아의 1~4월 중국... 20일 중국자동차공업협회에 따르면 올 1~4월 한국계 자동차(현대차·기아)의 점유율은 2.6%로 지난해 같은 기간...
2009,"현대차, 아마추어 레이싱팀 5년 연속 후원",https://biz.chosun.com/industry/car/2021/05/09/E3SCXE5QHFDO7F7G3LSQGLOUN4/?utm_source=naver&utm_medium=original&utm_campaign=biz,현대차(005380)가 아마추어 동호회 레이싱팀 ‘TEAM HMC’을 5년 연속 후원한다. 현대차는 서울 강남구 오토웨이타워에서 유원하 현대차 국내사업본부장(부사장)과 김주현 TEAM HMC 단장 등이 참석한 가운데 후원...
2010,"현대차·기아, 1~4월 中 시장점유율 2.6% '존재감 미미'",https://www.theguru.co.kr/news/article.html?no=21631,2%에서 '나홀로 하락' 전기차 중심 재도약 전략 발표했으나…반등은 '글쎄' 현대차와 기아의 1~4월 중국... 20일 중국자동차공업협회에 따르면 올 1~4월 한국계 자동차(현대차·기아)의 점유율은 2.6%로 지난해 같은 기간...
2011,"현대차, 아마추어 레이싱팀 5년 연속 후원",https://biz.chosun.com/industry/car/2021/05/09/E3SCXE5QHFDO7F7G3LSQGLOUN4/?utm_source=naver&utm_medium=original&utm_campaign=biz,현대차(005380)가 아마추어 동호회 레이싱팀 ‘TEAM HMC’을 5년 연속 후원한다. 현대차는 서울 강남구 오토웨이타워에서 유원하 현대차 국내사업본부장(부사장)과 김주현 TEAM HMC 단장 등이 참석한 가운데 후원...
2012,"현대차, 수동휠체어 전동화 사업 실시",http://www.digitaltoday.co.kr/news/articleView.html?idxno=403000,"현대차그룹이 장애인 이동편의를 위해 수동휠체어 전동화키트 보급·셰어링 사업을 3년째 이어간다. 현대차그룹은 20일 이병훈 현대차그룹 상무, 최공열 한국장애인단체총연맹 상임대표 등 행사 관계자들이 참석한..."
2013,현대차 체코공장 ‘최고 품질경영 능력’ 인정받다,https://www.ekn.kr/web/view.php?key=20210521010004060,현대차는 19일(현지시각) 체코 산업통상부 청사에서 열린 ‘2020 체코 국가 품질상’ 시상식에서... 이날 시상식은 카렐 하블리첵 체코 산업통상부 장관 겸 경제 부총리 등 주요 정부인사와 백철승 현대차...
2014,"현대차, 반도체 수급난에 노조 반발까지 ‘급제동’",https://www.dnews.co.kr/uhtml/view.jsp?idxno=202105181104535260021,"18일 업계에 따르면 현대차는 이날과 오는 20일 에어백 컨트롤 관련 반도체 재고가 부족으로 ‘아반떼’ㆍ... 앞서 현대차는 지난달 반도체 수급난으로 ‘그랜저’, ‘쏘나타’, ‘코나’ 등의 생산 차질을 빚기도 했다...."
2015,'묻고 더블로?'…현대차 미국 투자 '궁금증 셋',http://news.bizwatch.co.kr/article/industry/2021/05/14/0028,지난 1월 바이든 대통령이 '바이 아메리칸(Buy American)'을 선언한 뒤 4개월 만에 현대차는 '아메리칸 메이드(American-made)' 전기차를 약속했다. 방식은 전기차 전용 공장을 새로 짓는 것보다 현대차의 미국 앨라배마...
2016,"현대차, 2021 글로벌·아세안 H-Experience 인턴 모집",http://www.segyebiz.com/newsView/20210517516399?OutUrl=naver,[세계비즈=권영준 기자] 현대차가 국내외 인재들에게 다양한 직무 탐색 경험의 기회를 제공한다.... 현대차는 신사업 및 미래기술 분야 우수 연구 인력을 확보하고 아세안 시장 및 고객에 대한 이해도를 보유한...
2017,"LG엔솔, 현대차 손잡고 인니에 12억달러 배터리 공장 건설...곧 착공 나서",http://www.newsquest.co.kr/news/articleView.html?idxno=84753,[사진=연합뉴스] LG에너지솔루션이 현대차와 합작사를 출범해 인도네시아에 전기차 배터리 공장을... LG에너지는 단독으로 공장을 짓는 대신 현대차와 합작사 출범해 함께 현지 공장을 지을 것으로 알려졌다. 양사는...
2018,"현대차, 콩고 정부 관용차로 팰리세이드 500대 수출",http://news.einfomax.co.kr/news/articleView.html?idxno=4147703,현대차는 지난 15일 평택항에서 민주콩고로 수출되는 대형 스포츠유틸리티차량(SUV) 팰리세이드 500대 중 1차 선적분 250대를 선적했다고 16일 밝혔다. 팰리세이드 500대 공급은 현대차가 처음으로 중부 아프리카 국가의...
2019,"'반도체 보릿고개' 현대차·기아, 17~18일 가동중단 잇따라",http://www.fnnews.com/news/202105140834119739,"현대차도 추가적으로 휴업을 결정했다. ACU 관련 반도체 재고 부족으로 오는 17일과 18일 투싼과 넥쏘를 생산하는 울산 5공장을 휴업한다. 이와함께 아반떼, 베뉴를 생산하는 울산 3공장도 18일 휴업할 예정이다. 현대차..."
2020,"'반도체 보릿고개' 현대차·기아, 17~18일 가동중단 잇따라",http://www.fnnews.com/news/202105140834119739,"현대차도 추가적으로 휴업을 결정했다. ACU 관련 반도체 재고 부족으로 오는 17일과 18일 투싼과 넥쏘를 생산하는 울산 5공장을 휴업한다. 이와함께 아반떼, 베뉴를 생산하는 울산 3공장도 18일 휴업할 예정이다. 현대차..."
2021,"삼성·LG·SK·현대차, 美 반도체·전기차·배터리에 40조 붓는다",http://4th.kr/View.aspx?No=1639543,"/사진=연합뉴스 삼성·LG·SK·현대차 등 4대 그룹이 한미정상회담을 계기로 40조원이 넘는 미국 투자 계획을... SK이노베이션, 현대차, SK하이닉스는 394억 달러 규모의 투자 계획을 공개했다. 삼성전자는 신규 파운드리..."
2022,"반도체 공급난에… 현대차·기아, 일부 공장 '셧다운'",http://www.getnews.co.kr/news/articleView.html?idxno=530762,"17일 업계에 따르면 현대차는 울산 5공장 2라인을, 기아는 광명 2공장을 17~18일 휴업한다. 현대차는 18일 울산 3공장도 휴업할 계획이다. 울산 5공장 2라인은 투싼과 수소전기차 넥쏘를 생산하고, 울산 3공장은 아반떼와..."
2023,[단독] 현대차 '아이오닉5' 전시용 차량 풀린다…내달 초 고객 인도,http://isplus.live.joins.com/news/article/article.asp?total_id=24064707,"""전시차 팝니다"" 문자 일괄 발송 23일 완성차 업계에 따르면 현대차 직영점과 대리점 직원들은 지난 2월... 직영점은 현대차 국내 영업본부에서 관할하는 곳이며 대리점은 현대차와 상호계약을 맺고 운영하는 곳이다...."
2024,"현대차·기아, 올해 사내 최고 발명은…'자율주행차 지도 오차 보조장치'",http://www.newsworks.co.kr/news/articleView.html?idxno=549877,현대차∙기아는 연구개발 부문의 신기술 및 양산 차량 개발 과정에서 도출된 혁신적인 아이디어를 선별해 특허 출원 및 포상을 시행해왔다. 올해는 지난해 현대차·기아에서 특허로 출원한 3100여건의 사내 발명...
2025,"현대차, 차박 체험 플랫폼 '휠핑' 참가자 모집",http://www.kbiznews.co.kr/news/articleView.html?idxno=81629,"현대차는 이번 '휠핑' 서비스를 이용하는 고객 전원에게 오뚜기 간편식, 간편양념 및 에코백, 손소독제... 응모 방법, 이용 안내 등 '휠핑' 서비스에 관한 보다 자세한 사항은 휠핑 사이트 및 현대차 홈페이지에서 확인할..."
2026,"현대차, 글로벌·아세안 H-Experience 인턴 모집",http://www.thedrive.co.kr/news/newsview.php?ncode=1065595336299353,현대차는 신사업 및 미래기술 분야 우수 연구 인력을 확보하고 아세안 시장 및 고객에 대한 이해도를... 글로벌 인턴십과 아세안 인턴십에 선발된 인원은 각 소속에 따라 ▲현대차 신기술 및 미래 모빌리티 체험 ▲주요...
2027,MZ세대가 이끄는 현대차 ‘사무직 노조’,https://www.seoul.co.kr/news/newsView.php?id=20210426021031&wlog_tag3=naver,현대차그룹 내 생산직이 포함되지 않고 사무직 직원 만으로 구성된 노조가 탄생하는 건 처음이다. 올해... 25일 업계에 따르면 현대차그룹 사무직 직원으로 구성된 ‘현대차그룹 인재존중 사무연구직 노동조합’은 26일...
2028,"“현대차, 미국 진출 시나리오 가시화… 밸류에이션 상승 기대”",https://www.news2day.co.kr/article/20210525500216,"유지웅 이베스트투자증권 연구원은 “현대차는 그룹사의 미국 전기차 투자 확대에 따른 최대 수혜가 예상된다”며 “미국시장은 현대차의 판매 지역 중 가장 이익 레버리지가 큰 지역이며, 지난해 하반기 들어서야..."
2029,"현대차 체코공장, ‘체코 국가 품질상’ 4회 연속 수상",http://www.lawissue.co.kr/view.php?ud=20210521120918385967191f6c6e_12,현대차는 19일(현지시각) 체코 산업통상부 청사에서 열린 ‘2020 체코 국가 품질상’ 시상식에서... 백철승 현대차 체코생산법인장 등 관계자들이 참석한 가운데 온라인 현장 생중계로 진행됐다. 1995년부터 시작된...
2030,"아이오닉5 판매 앞둔 현대차···""美서 전기차 생산, 8조원 투자""",https://news.joins.com/article/olink/23651799,"13일 업계에 따르면 현대차는 전기차와 수소 인프라, 도심항공교통(UAM) 등에 총 74억 달러(약 8조1000억원)를... 현대차는 오는 21일 열리는 한미정상회담을 앞두고 이르면 내주 초 이 같은 내용의 투자 계획을 발표할..."
2031,현대차 체코공장 '체코 국가 품질상',http://www.naeil.com/news_view/?id_art=386805,시상식에서 현대차 체코공장(HMMC)이 '엑셀런스' 분야 산업 부문에서 체코 현지 기업 중 유일하게 4회 연속... 이날 시상식은 카렐 하블리첵 체코 산업통상부 장관 겸 경제부총리 등 주요 정부인사와 백철승 현대차...
2032,"현대차, '현대 모빌리티 카드' 론칭…""고객 편의 지향""",http://news.tf.co.kr/read/economy/1856900.htm,현대차 신차 구매 시 차값 1.5% 특별 적립 현대자동차(현대차)가 26일 현대카드와 함께 더욱 강력해진 혜택을 담은 'Hyundai Mobility 카드'를 출시했다고 밝혔다. 'Hyundai Mobility 카드'는 신차 구매고객에게 필요한 혜택을...
2033,"현대차 체코공장, 국가 품질상 '4회 연속 최우수상'",http://www.upinews.kr/newsView/upi202105210017,▲ 백철승 현대차 체코생산법인장(왼쪽)과 마틴 클리츠닉(Martin Klicnik) 체코생산법인 품질부실장이... [현대차 제공] 현대차는 19일(현지시간) 체코 산업통상부 청사에서 열린'2020 체코 국가 품질상(2020 Czech...
2034,"현대차, 콩고민주공화국에 팰리세이드 500대 수출",http://www.getnews.co.kr/news/articleView.html?idxno=530636,"사진 출처 = 현대차 현대차가 콩고민주공화국 정부 대상 대규모 차량 공급을 통해 아프리카 신 시장 개척에 나섰다. 현대자동차는 지난 15일 평택항에서 콩고민주공화국(Democratic Republic of the Congo, 이하 DR콩고)으로..."
2035,"현대차·UNDP, 지속가능 프로젝트 첫 솔루션 공개",http://www.newsis.com/view/?id=NISX20210506_0001431989&cID=13001&pID=13000,"'포 투모로우'는 현대차와 유엔개발계획(UNDP)가 지난해 9월 업무 협약을 체결하고 함께 진행하는 프로젝트로... 현대차와 UNDP는 원활한 프로젝트 추진을 위해 누구나 지속가능한 미래에 대한 솔루션을 제안하고, 마음에..."
2036,"현대차 노조 미국 투자계획 반대, ""일방통행은 파국을 부를 뿐""",https://www.businesspost.co.kr/BP?command=article_view&num=231931,"전국금속노동조합 현대자동차지부(현대차 노조)가 현대차그룹의 대규모 미국 투자계획에 반대했다. 현대차 노조는 17일 성명서를 내고 ""사측의 일방적 투자계획에 반대입장을 분명히 밝힌다""며 ""조합원을 무시하는..."
2037,"현대차, 2021 글로벌·아세안 H-Experience 인턴 모집",http://www.jjan.kr/news/articleView.html?idxno=2108427,"현대차가 국내외 인재들에게 다양한 직무 탐색 경험 기회를 제공한다. 또, 우수 수료자에 대해서는... 현대차는 신사업 및 미래기술 분야 우수 연구 인력을 확보하고 아세안 시장 및 고객에 대한 이해도를 보유한..."
2038,"현대차, '반도체 품귀'에 아이오닉5 이어 그랜저도 생산중단",http://www.newsis.com/view/?id=NISX20210409_0001401619&cID=13001&pID=13000,"현대차는 오는 12~13일 아산공장 가동을 중단키로 했다고 9일 밝혔다. 현대차는 차량용 반도체 등 전장시스템 전반을 제어하는 '파워 컨트롤 유닛(PCU)' 부족으로 노동조합과 아산공장 가동중단 문제를 논의해왔으며, 12..."
2039,"현대차·기아, SUV·MPV 신차 앞세워 인도 시장 공략 '가속'",https://www.theguru.co.kr/news/article.html?no=21893,"31일 업계에 따르면 현대차는 오는 6월 신흥시장을 타깃으로 새로이 개발한 7인승 SUV '알카자르'를 인도... <본보 2021년 4월26일자 참조 현대차, 인도 코로나 재유행에 신차 '알카자르' 출시 연기> 내년 중 경형 SUV 'AX1'와..."
2040,"현대차, 울산공장 포터라인 6~7일 휴업...""반도체 부족""",http://www.fnnews.com/news/202105031502365118,3일 현대차는 포터를 생산하는 울산4공장의 2라인을 휴업하기로 했다. 계기판 등에 사용되는 차량용 반도체의 재고 부족이 원인으로 알려졌다. 현대차는 지난달에도 반도체와 일부 부품수급 차질로 아이오닉5와 코나를...
2041,"""올여름, 아이오닉5로 캠핑 즐기자""…현대차, '차박' 참가자 모집",https://www.etoday.co.kr/news/view/2025996,제공 현대차는 본격적인 휴가철을 맞아 6월 4일부터 8월 22일까지 운영되는 차박 체험 플랫폼 ‘휠핑’의 참가자를 모집한다. (사진제공=현대차) 현대자동차가 본격적인 휴가철을 맞아 차박(차에서 하는 숙박) 경험을...
2042,"현대차, 동호회 레이싱팀 5년 연속 후원…""車 문화 활성화""",https://www.news1.kr/articles/?4300434,TEAM HMC는 현대차 브랜드를 좋아하는 고객들이 자발적으로 만든 동호회 '현대모터클럽' 회원으로 구성된... 현대차는 TEAM HMC에 Δ전문 드라이빙 수트 Δ차량 관리를 위한 전속 미케닉 팀 Δ경기 출전에 따른 소정의 경비...
2043,현대차도 ‘개발자 모시기’ 뛰어든다,http://www.hani.co.kr/arti/economy/marketing/989358.html,현대차는 2일 자동차 산업변화가 가속화하는 가운데 미래 스마트 모빌리티를 구축할 우수인재를 공격적으로... 자세한 사항은 현대차 누리집 채용 사이트에서 확인할 수 있다. 현대차 관계자는 “미래 핵심 인재를 확보해...
2044,"현대차, 항공안전기술원과 UAM 산업 발전 업무협약",http://news.tf.co.kr/read/economy/1856114.htm,"현대자동차(현대차)가 미래 모빌리티 시장을 선도하기 위해 국내 도심항공교통(UAM), 무인항공시스템(UAS), 항공용 수소연료전지시스템 개발에 본격적으로 나선다. 22일 현대차는 전날(21일) 항공안전기술원(KIAST)과..."
2045,"현대차, 2021 글로벌·아세안 H-Experience 인턴 모집",http://www.thebigdata.co.kr/view.php?ud=202105171332021895d0a8833aad_23,현대차가 국내외 인재들에게 다양한 직무 탐색 경험의 기회를 제공한다. 현대자동차는 30일(일)까지 채용... 현대차는 신사업 및 미래기술 분야 우수 연구 인력을 확보하고 아세안 시장 및 고객에 대한 이해도를...
2046,"현대차 전주공장 노사, 취약계층 아동 안전한 성장 돕는다",http://www.newsis.com/view/?id=NISX20210513_0001440405&cID=10808&pID=10800,현대차 전주공장 노사는 13일 사회공헌기금 3500만원을 완주군과 세이브더칠드런에 전달했다. 이날 성금... 현대차 전주공장 노사는 아동들이 안전하고 건강하게 잘 성장할 수 있도록 최근 5년 동안 1억8000만원의...
2047,"반도체 수급 차질에…현대차, 울산 이어 아산공장도 멈춘다",http://yna.kr/AKR20210409102800003?did=1195m,글로벌 차량용 반도체 부족 사태가 장기화하는 가운데 현대차가 울산 1공장의 휴업에 들어간 데 이어 아산공장의 가동도 결국 중단하기로 했다. 현대차는 오는 12∼13일 아산공장의 가동을 중단한다고 9일 밝혔다. 이는...
2048,"현대차, 이산화탄소 배출 걱정 없는 신형 엑시언트 수소전기트럭 출시",http://www.metroseoul.co.kr/article/20210525500053,현대차 2021년형 엑시언트 수소전기트럭. 현대자동차가 이산화탄소 배출걱정 없는 수소전기트럭을 국내 출시한다. 현대차는 2021년형 엑시언트 수소전기트럭을 출시했다고 25일 밝혔다. 엑시언트 수소전기트럭은...
2049,"현대차·기아, 미래모빌리티 인재 적극 지원..11번째 발명의 날 행사 개최",http://kpenews.com/View.aspx?No=1641155,현대차·기아는 지난 20일 경기 화성 남양연구소에서 ‘발명의 날’ 행사를 개최했다고 밝혔다. ‘발명의 날’은 국내 자동차 업계의 대표적인 RD 지식 경연 행사 중 하나다. 현대차·기아는 연구개발 부문의 신기술...
2050,현대차·네이버·SKT 손잡고 'K-메타버스' 개방형 생태계 키운다,http://news.mt.co.kr/mtview.php?no=2021051810422860549,"업계에선 현대차와 분당서울대병원, 네이버랩스, 맥스트, 버넥트, 라온텍, SK텔레콤, KT, LG유플러스, KBS, MBC, SBS, EBS, MBN, 카카오엔터, CJ E&M, 롯데월드 등이 참여했다. 정보통신산업진흥원(NIPA), 한국전파진흥협회(RAPA)..."
